{
  "$schema": "urn:watchtower:schema:artifacts:records:trace-purge-record:v1",
  "id": "purge.pack_domain_hardcoding_remediation",
  "title": "Trace Purge Record for Pack Domain Hardcoding Remediation",
  "status": "active",
  "trace_id": "trace.pack_domain_hardcoding_remediation",
  "initiative_status": "completed",
  "closed_at": "2026-03-20T01:25:48Z",
  "purged_at": "2026-03-24T01:18:15Z",
  "closure_reason": "Removed remaining pack-domain hardcoding from reusable core, moved plan-domain runtime under plan/python, and validated the pack-driven endstate.",
  "summary": "Removed the closed trace-local planning package after validating terminal state, acceptance reconciliation, and surviving canonical authority.",
  "surviving_authority_paths": [
    "core",
    "core/control_plane/manifests",
    "core/docs",
    "core/python/src/watchtower_core",
    "core/python/src/watchtower_core/cli",
    "plan",
    "plan/.wt",
    "plan/docs",
    "plan/python",
    "plan/tracking"
  ],
  "purged_paths": [
    "plan/initiatives/pack_domain_hardcoding_remediation/.wt/closeout/closeout_recap.bootstrap.json",
    "plan/initiatives/pack_domain_hardcoding_remediation/.wt/events/0001_created.json",
    "plan/initiatives/pack_domain_hardcoding_remediation/.wt/events/0002_scope_defined.json",
    "plan/initiatives/pack_domain_hardcoding_remediation/.wt/events/0003_authored_inputs_confirmed.json",
    "plan/initiatives/pack_domain_hardcoding_remediation/.wt/events/0004_task_state_seeded.json",
    "plan/initiatives/pack_domain_hardcoding_remediation/.wt/events/0005_evidence_shell_seeded.json",
    "plan/initiatives/pack_domain_hardcoding_remediation/.wt/events/0006_closeout_shell_seeded.json",
    "plan/initiatives/pack_domain_hardcoding_remediation/.wt/events/0007_promotion_shell_seeded.json",
    "plan/initiatives/pack_domain_hardcoding_remediation/.wt/events/0008_ready_for_review_marked.json",
    "plan/initiatives/pack_domain_hardcoding_remediation/.wt/events/0009_authored_inputs_confirmed.json",
    "plan/initiatives/pack_domain_hardcoding_remediation/.wt/events/0010_ready_for_execution_approved.json",
    "plan/initiatives/pack_domain_hardcoding_remediation/.wt/events/0011_ready_for_execution_marked.json",
    "plan/initiatives/pack_domain_hardcoding_remediation/.wt/events/0012_execution_started.json",
    "plan/initiatives/pack_domain_hardcoding_remediation/.wt/events/0013_authored_inputs_confirmed.json",
    "plan/initiatives/pack_domain_hardcoding_remediation/.wt/events/0014_authored_inputs_confirmed.json",
    "plan/initiatives/pack_domain_hardcoding_remediation/.wt/events/0015_closing_started.json",
    "plan/initiatives/pack_domain_hardcoding_remediation/.wt/events/0016_completed.json",
    "plan/initiatives/pack_domain_hardcoding_remediation/.wt/evidence/validation_bundle.bootstrap.json",
    "plan/initiatives/pack_domain_hardcoding_remediation/.wt/initiative.json",
    "plan/initiatives/pack_domain_hardcoding_remediation/.wt/promotions/guidance_promotion_record.bootstrap.json",
    "plan/initiatives/pack_domain_hardcoding_remediation/.wt/tasks/bootstrap_pack_domain_hardcoding_remediation/events/0001_created.json",
    "plan/initiatives/pack_domain_hardcoding_remediation/.wt/tasks/bootstrap_pack_domain_hardcoding_remediation/events/0002_status_changed.json",
    "plan/initiatives/pack_domain_hardcoding_remediation/.wt/tasks/bootstrap_pack_domain_hardcoding_remediation/task.json",
    "plan/initiatives/pack_domain_hardcoding_remediation/.wt/tasks/pack_drive_runtime_roots_and_validation_selection/events/0001_created.json",
    "plan/initiatives/pack_domain_hardcoding_remediation/.wt/tasks/pack_drive_runtime_roots_and_validation_selection/events/0002_status_changed.json",
    "plan/initiatives/pack_domain_hardcoding_remediation/.wt/tasks/pack_drive_runtime_roots_and_validation_selection/events/0003_status_changed.json",
    "plan/initiatives/pack_domain_hardcoding_remediation/.wt/tasks/pack_drive_runtime_roots_and_validation_selection/task.json",
    "plan/initiatives/pack_domain_hardcoding_remediation/.wt/tasks/re_root_governed_contracts_and_generated_surfaces/events/0001_created.json",
    "plan/initiatives/pack_domain_hardcoding_remediation/.wt/tasks/re_root_governed_contracts_and_generated_surfaces/events/0002_status_changed.json",
    "plan/initiatives/pack_domain_hardcoding_remediation/.wt/tasks/re_root_governed_contracts_and_generated_surfaces/events/0003_status_changed.json",
    "plan/initiatives/pack_domain_hardcoding_remediation/.wt/tasks/re_root_governed_contracts_and_generated_surfaces/task.json",
    "plan/initiatives/pack_domain_hardcoding_remediation/.wt/tasks/recover_rich_human_docs_and_guidance_from_pack_driven_state/events/0001_created.json",
    "plan/initiatives/pack_domain_hardcoding_remediation/.wt/tasks/recover_rich_human_docs_and_guidance_from_pack_driven_state/events/0002_status_changed.json",
    "plan/initiatives/pack_domain_hardcoding_remediation/.wt/tasks/recover_rich_human_docs_and_guidance_from_pack_driven_state/events/0003_status_changed.json",
    "plan/initiatives/pack_domain_hardcoding_remediation/.wt/tasks/recover_rich_human_docs_and_guidance_from_pack_driven_state/task.json",
    "plan/initiatives/pack_domain_hardcoding_remediation/.wt/tasks/run_assessment_pass_one/events/0001_created.json",
    "plan/initiatives/pack_domain_hardcoding_remediation/.wt/tasks/run_assessment_pass_one/events/0002_status_changed.json",
    "plan/initiatives/pack_domain_hardcoding_remediation/.wt/tasks/run_assessment_pass_one/events/0003_status_changed.json",
    "plan/initiatives/pack_domain_hardcoding_remediation/.wt/tasks/run_assessment_pass_one/task.json",
    "plan/initiatives/pack_domain_hardcoding_remediation/.wt/tasks/run_assessment_pass_two/events/0001_created.json",
    "plan/initiatives/pack_domain_hardcoding_remediation/.wt/tasks/run_assessment_pass_two/events/0002_status_changed.json",
    "plan/initiatives/pack_domain_hardcoding_remediation/.wt/tasks/run_assessment_pass_two/events/0003_status_changed.json",
    "plan/initiatives/pack_domain_hardcoding_remediation/.wt/tasks/run_assessment_pass_two/task.json",
    "plan/initiatives/pack_domain_hardcoding_remediation/.wt/tasks/split_core_and_plan_python_boundary/events/0001_created.json",
    "plan/initiatives/pack_domain_hardcoding_remediation/.wt/tasks/split_core_and_plan_python_boundary/events/0002_status_changed.json",
    "plan/initiatives/pack_domain_hardcoding_remediation/.wt/tasks/split_core_and_plan_python_boundary/events/0003_status_changed.json",
    "plan/initiatives/pack_domain_hardcoding_remediation/.wt/tasks/split_core_and_plan_python_boundary/events/0004_status_changed.json",
    "plan/initiatives/pack_domain_hardcoding_remediation/.wt/tasks/split_core_and_plan_python_boundary/task.json",
    "plan/initiatives/pack_domain_hardcoding_remediation/.wt/tasks/verify_report_findings_and_map_pack_roots/events/0001_created.json",
    "plan/initiatives/pack_domain_hardcoding_remediation/.wt/tasks/verify_report_findings_and_map_pack_roots/events/0002_status_changed.json",
    "plan/initiatives/pack_domain_hardcoding_remediation/.wt/tasks/verify_report_findings_and_map_pack_roots/task.json",
    "plan/initiatives/pack_domain_hardcoding_remediation/decision_notes.md",
    "plan/initiatives/pack_domain_hardcoding_remediation/design_record.md",
    "plan/initiatives/pack_domain_hardcoding_remediation/implementation_slice.md",
    "plan/initiatives/pack_domain_hardcoding_remediation/initiative_brief.md",
    "plan/initiatives/pack_domain_hardcoding_remediation/plan.md",
    "plan/initiatives/pack_domain_hardcoding_remediation/progress.md",
    "plan/initiatives/pack_domain_hardcoding_remediation/summary.md"
  ]
}
