{
  "$schema": "urn:watchtower:schema:artifacts:records:trace-purge-record:v1",
  "id": "purge.transition_surface_retirement",
  "title": "Trace Purge Record for Transition Surface Retirement Acceptance Contract",
  "status": "active",
  "trace_id": "trace.transition_surface_retirement",
  "initiative_status": "completed",
  "closed_at": "2026-03-16T19:39:28Z",
  "purged_at": "2026-03-19T07:19:14Z",
  "closure_reason": "Retired the remaining transition facades, bridge modules, marker tests, stale current path references, and temporary audit leftovers; refreshed governed discovery surfaces; and reran clean acceptance, validation, test, typecheck, and lint passes.",
  "summary": "Removed the legacy docs-backed planning package, acceptance contract, and validation evidence as part of the hard cutover to live plan authority.",
  "surviving_authority_paths": [
    "core/control_plane/",
    "core/control_plane/indexes/repository_paths/repository_path_index.json",
    "core/python/",
    "core/python/src/watchtower_core/cli/",
    "core/python/src/watchtower_core/cli/README.md",
    "core/python/src/watchtower_core/control_plane/models/",
    "core/python/src/watchtower_core/control_plane/models/__init__.py",
    "core/python/src/watchtower_core/plan_runtime/validation/",
    "core/python/tests/integration/",
    "core/python/tests/integration/README.md",
    "core/python/tests/unit/",
    "core/python/tests/unit/README.md",
    "core/python/tests/unit/test_cli.py",
    "core/python/tests/unit/test_control_plane_model_exports.py",
    "core/python/tests/unit/test_repo_ops_boundary.py",
    "decisions.md",
    "docs/standards/governance/rewrite_surface_classification_standard.md",
    "docs/standards/metadata/naming_and_ids_standard.md",
    "plan/tracking/coordination_tracking.md",
    "plan/tracking/initiative_tracking.md",
    "plan/tracking/task_tracking.md",
    "requirements.md"
  ],
  "purged_paths": [
    "core/control_plane/contracts/acceptance/transition_surface_retirement_acceptance.json",
    "core/control_plane/records/validation_evidence/transition_surface_retirement_planning_baseline.json",
    "docs/planning/",
    "docs/planning/decisions/decision_tracking.md",
    "docs/planning/decisions/transition_surface_retirement_direction.md",
    "docs/planning/design/design_tracking.md",
    "docs/planning/design/features/transition_surface_retirement.md",
    "docs/planning/design/implementation/transition_surface_retirement.md",
    "docs/planning/prds/prd_tracking.md",
    "docs/planning/prds/transition_surface_retirement.md",
    "docs/planning/tasks/closed/archive/2026/03/16/retire_remaining_transition_modules_and_marker_tests.md",
    "docs/planning/tasks/closed/archive/2026/03/16/transition_surface_retirement_bootstrap.md",
    "docs/planning/tasks/closed/archive/2026/03/16/validate_and_close_transition_surface_retirement.md"
  ]
}
