{
  "$schema": "urn:watchtower:schema:artifacts:records:trace-purge-record:v1",
  "id": "purge.internal_project_standards_review_and_hardening",
  "title": "Trace Purge Record for Internal Project Standards Review and Hardening Acceptance Contract",
  "status": "active",
  "trace_id": "trace.internal_project_standards_review_and_hardening",
  "initiative_status": "completed",
  "closed_at": "2026-03-11T18:00:45Z",
  "purged_at": "2026-03-19T07:19:14Z",
  "closure_reason": "Completed the internal standards review, aligned standard-reference enforcement, normalized remaining decision-index document-relative path projection, published durable evidence, and revalidated the repository baseline.",
  "summary": "Removed the legacy docs-backed planning package, acceptance contract, and validation evidence as part of the hard cutover to live plan authority.",
  "surviving_authority_paths": [
    "core/control_plane/indexes/coordination/coordination_index.json",
    "core/control_plane/indexes/initiatives/initiative_index.json",
    "core/control_plane/indexes/tasks/task_index.json",
    "core/python/src/watchtower_core/adapters/markdown.py",
    "core/python/src/watchtower_core/plan_runtime/planning_documents.py",
    "core/python/src/watchtower_core/plan_runtime/standards.py",
    "core/python/src/watchtower_core/plan_runtime/sync/foundation_index.py",
    "core/python/src/watchtower_core/plan_runtime/sync/reference_index.py",
    "core/python/src/watchtower_core/plan_runtime/sync/standard_index.py",
    "core/python/src/watchtower_core/plan_runtime/sync/workflow_index.py",
    "core/python/src/watchtower_core/plan_runtime/validation/document_semantics.py",
    "core/python/tests/unit/",
    "core/python/tests/unit/README.md",
    "core/python/tests/unit/test_governed_markdown_reference_resolution.py",
    "core/python/tests/unit/test_reference_index_sync.py",
    "core/python/tests/unit/test_standard_index_sync.py",
    "core/python/tests/unit/test_workflow_index_sync.py",
    "decisions.md",
    "docs/standards/data_contracts/decision_index_standard.md",
    "docs/standards/data_contracts/standard_index_standard.md",
    "docs/standards/documentation/documentation_semantics_standard.md",
    "docs/standards/documentation/reference_md_standard.md",
    "docs/standards/documentation/standard_md_standard.md",
    "docs/standards/documentation/workflow_md_standard.md",
    "plan/tracking/coordination_tracking.md",
    "plan/tracking/initiative_tracking.md",
    "plan/tracking/task_tracking.md",
    "requirements.md"
  ],
  "purged_paths": [
    "core/control_plane/contracts/acceptance/internal_project_standards_review_and_hardening_acceptance.json",
    "core/control_plane/records/validation_evidence/internal_project_standards_review_and_hardening_planning_baseline.json",
    "docs/planning/decisions/internal_project_standards_review_and_hardening_direction.md",
    "docs/planning/design/design_tracking.md",
    "docs/planning/design/features/internal_project_standards_review_and_hardening.md",
    "docs/planning/design/implementation/internal_project_standards_review_and_hardening.md",
    "docs/planning/prds/internal_project_standards_review_and_hardening.md",
    "docs/planning/prds/prd_tracking.md",
    "docs/planning/tasks/closed/archive/2026/03/11/align_standard_semantic_validation_with_standard_index_reference_accounting.md",
    "docs/planning/tasks/closed/archive/2026/03/11/internal_project_standards_review_and_hardening_bootstrap.md",
    "docs/planning/tasks/closed/archive/2026/03/11/make_governed_repo_path_extraction_source_aware_for_document_relative_links.md"
  ]
}
