{
  "$schema": "urn:watchtower:schema:artifacts:records:trace-purge-record:v1",
  "id": "purge.copied_core_discovery_surface_reconciliation_followup",
  "title": "Trace Purge Record for Copied Core Discovery Surface Reconciliation Followup",
  "status": "active",
  "trace_id": "trace.copied_core_discovery_surface_reconciliation_followup",
  "initiative_status": "completed",
  "closed_at": "2026-03-23T18:17:30Z",
  "purged_at": "2026-03-24T01:23:02Z",
  "closure_reason": "Expanded copied-core bootstrap reconciliation, normalized routed workflow paths, and removed root-pack-only pack contract assumptions.",
  "summary": "Removed the closed trace-local planning package after validating terminal state, acceptance reconciliation, and surviving canonical authority.",
  "surviving_authority_paths": [
    "core/docs",
    "core/python/src/watchtower_core/control_plane",
    "core/python/src/watchtower_core/pack_integration"
  ],
  "purged_paths": [
    "plan/initiatives/copied_core_discovery_surface_reconciliation_followup/.wt/closeout/closeout_recap.bootstrap.json",
    "plan/initiatives/copied_core_discovery_surface_reconciliation_followup/.wt/discrepancies/decision_notes_drift.json",
    "plan/initiatives/copied_core_discovery_surface_reconciliation_followup/.wt/discrepancies/design_record_drift.json",
    "plan/initiatives/copied_core_discovery_surface_reconciliation_followup/.wt/discrepancies/implementation_slice_drift.json",
    "plan/initiatives/copied_core_discovery_surface_reconciliation_followup/.wt/discrepancies/initiative_brief_drift.json",
    "plan/initiatives/copied_core_discovery_surface_reconciliation_followup/.wt/discrepancies/review_index_index_drift.json",
    "plan/initiatives/copied_core_discovery_surface_reconciliation_followup/.wt/events/0001_created.json",
    "plan/initiatives/copied_core_discovery_surface_reconciliation_followup/.wt/events/0002_scope_defined.json",
    "plan/initiatives/copied_core_discovery_surface_reconciliation_followup/.wt/events/0003_authored_inputs_confirmed.json",
    "plan/initiatives/copied_core_discovery_surface_reconciliation_followup/.wt/events/0004_task_state_seeded.json",
    "plan/initiatives/copied_core_discovery_surface_reconciliation_followup/.wt/events/0005_evidence_shell_seeded.json",
    "plan/initiatives/copied_core_discovery_surface_reconciliation_followup/.wt/events/0006_closeout_shell_seeded.json",
    "plan/initiatives/copied_core_discovery_surface_reconciliation_followup/.wt/events/0007_promotion_shell_seeded.json",
    "plan/initiatives/copied_core_discovery_surface_reconciliation_followup/.wt/events/0008_ready_for_review_marked.json",
    "plan/initiatives/copied_core_discovery_surface_reconciliation_followup/.wt/events/0009_authored_inputs_confirmed.json",
    "plan/initiatives/copied_core_discovery_surface_reconciliation_followup/.wt/events/0010_authored_inputs_confirmed.json",
    "plan/initiatives/copied_core_discovery_surface_reconciliation_followup/.wt/events/0011_ready_for_review_marked.json",
    "plan/initiatives/copied_core_discovery_surface_reconciliation_followup/.wt/events/0012_ready_for_execution_approved.json",
    "plan/initiatives/copied_core_discovery_surface_reconciliation_followup/.wt/events/0013_ready_for_execution_marked.json",
    "plan/initiatives/copied_core_discovery_surface_reconciliation_followup/.wt/events/0014_execution_started.json",
    "plan/initiatives/copied_core_discovery_surface_reconciliation_followup/.wt/events/0015_closing_started.json",
    "plan/initiatives/copied_core_discovery_surface_reconciliation_followup/.wt/events/0016_completed.json",
    "plan/initiatives/copied_core_discovery_surface_reconciliation_followup/.wt/evidence/validation_bundle.bootstrap.json",
    "plan/initiatives/copied_core_discovery_surface_reconciliation_followup/.wt/initiative.json",
    "plan/initiatives/copied_core_discovery_surface_reconciliation_followup/.wt/promotions/guidance_promotion_record.bootstrap.json",
    "plan/initiatives/copied_core_discovery_surface_reconciliation_followup/.wt/tasks/bootstrap_copied_core_discovery_surface_reconciliation_followup/events/0001_created.json",
    "plan/initiatives/copied_core_discovery_surface_reconciliation_followup/.wt/tasks/bootstrap_copied_core_discovery_surface_reconciliation_followup/events/0002_status_changed.json",
    "plan/initiatives/copied_core_discovery_surface_reconciliation_followup/.wt/tasks/bootstrap_copied_core_discovery_surface_reconciliation_followup/task.json",
    "plan/initiatives/copied_core_discovery_surface_reconciliation_followup/decision_notes.md",
    "plan/initiatives/copied_core_discovery_surface_reconciliation_followup/design_record.md",
    "plan/initiatives/copied_core_discovery_surface_reconciliation_followup/implementation_slice.md",
    "plan/initiatives/copied_core_discovery_surface_reconciliation_followup/initiative_brief.md",
    "plan/initiatives/copied_core_discovery_surface_reconciliation_followup/plan.md",
    "plan/initiatives/copied_core_discovery_surface_reconciliation_followup/progress.md",
    "plan/initiatives/copied_core_discovery_surface_reconciliation_followup/summary.md"
  ]
}
