{
  "$schema": "urn:watchtower:schema:artifacts:records:trace-purge-record:v1",
  "id": "purge.root_pack_schema_catalog_contract_alignment",
  "title": "Trace Purge Record for Root Pack Schema Catalog Contract Alignment",
  "status": "active",
  "trace_id": "trace.root_pack_schema_catalog_contract_alignment",
  "initiative_status": "completed",
  "closed_at": "2026-03-22T23:08:32Z",
  "purged_at": "2026-03-24T01:19:03Z",
  "closure_reason": "Implemented donor-neutral schema-catalog canonical-path support for first-party root packs and validated it with reusable-core unit and CLI regression coverage.",
  "summary": "Removed the closed trace-local planning package after validating terminal state, acceptance reconciliation, and surviving canonical authority.",
  "surviving_authority_paths": [
    "core/control_plane/schemas/artifacts/schema_catalog.schema.json",
    "core/docs/references/domain_pack_authoring_reference.md",
    "core/python/tests"
  ],
  "purged_paths": [
    "plan/initiatives/root_pack_schema_catalog_contract_alignment/.wt/closeout/closeout_recap.bootstrap.json",
    "plan/initiatives/root_pack_schema_catalog_contract_alignment/.wt/discrepancies/decision_notes_drift.json",
    "plan/initiatives/root_pack_schema_catalog_contract_alignment/.wt/discrepancies/design_record_drift.json",
    "plan/initiatives/root_pack_schema_catalog_contract_alignment/.wt/discrepancies/implementation_slice_drift.json",
    "plan/initiatives/root_pack_schema_catalog_contract_alignment/.wt/discrepancies/initiative_brief_drift.json",
    "plan/initiatives/root_pack_schema_catalog_contract_alignment/.wt/discrepancies/review_index_index_drift.json",
    "plan/initiatives/root_pack_schema_catalog_contract_alignment/.wt/events/0001_created.json",
    "plan/initiatives/root_pack_schema_catalog_contract_alignment/.wt/events/0002_scope_defined.json",
    "plan/initiatives/root_pack_schema_catalog_contract_alignment/.wt/events/0003_authored_inputs_confirmed.json",
    "plan/initiatives/root_pack_schema_catalog_contract_alignment/.wt/events/0004_task_state_seeded.json",
    "plan/initiatives/root_pack_schema_catalog_contract_alignment/.wt/events/0005_evidence_shell_seeded.json",
    "plan/initiatives/root_pack_schema_catalog_contract_alignment/.wt/events/0006_closeout_shell_seeded.json",
    "plan/initiatives/root_pack_schema_catalog_contract_alignment/.wt/events/0007_promotion_shell_seeded.json",
    "plan/initiatives/root_pack_schema_catalog_contract_alignment/.wt/events/0008_ready_for_review_marked.json",
    "plan/initiatives/root_pack_schema_catalog_contract_alignment/.wt/events/0009_authored_inputs_confirmed.json",
    "plan/initiatives/root_pack_schema_catalog_contract_alignment/.wt/events/0010_authored_inputs_confirmed.json",
    "plan/initiatives/root_pack_schema_catalog_contract_alignment/.wt/events/0011_ready_for_review_marked.json",
    "plan/initiatives/root_pack_schema_catalog_contract_alignment/.wt/events/0012_ready_for_execution_approved.json",
    "plan/initiatives/root_pack_schema_catalog_contract_alignment/.wt/events/0013_ready_for_execution_marked.json",
    "plan/initiatives/root_pack_schema_catalog_contract_alignment/.wt/events/0014_execution_started.json",
    "plan/initiatives/root_pack_schema_catalog_contract_alignment/.wt/events/0015_closing_started.json",
    "plan/initiatives/root_pack_schema_catalog_contract_alignment/.wt/events/0016_completed.json",
    "plan/initiatives/root_pack_schema_catalog_contract_alignment/.wt/evidence/validation_bundle.bootstrap.json",
    "plan/initiatives/root_pack_schema_catalog_contract_alignment/.wt/initiative.json",
    "plan/initiatives/root_pack_schema_catalog_contract_alignment/.wt/promotions/guidance_promotion_record.bootstrap.json",
    "plan/initiatives/root_pack_schema_catalog_contract_alignment/.wt/tasks/bootstrap_root_pack_schema_catalog_contract_alignment/events/0001_created.json",
    "plan/initiatives/root_pack_schema_catalog_contract_alignment/.wt/tasks/bootstrap_root_pack_schema_catalog_contract_alignment/events/0002_status_changed.json",
    "plan/initiatives/root_pack_schema_catalog_contract_alignment/.wt/tasks/bootstrap_root_pack_schema_catalog_contract_alignment/task.json",
    "plan/initiatives/root_pack_schema_catalog_contract_alignment/.wt/tasks/validate_and_close_root_pack_schema_contract_slice/events/0001_created.json",
    "plan/initiatives/root_pack_schema_catalog_contract_alignment/.wt/tasks/validate_and_close_root_pack_schema_contract_slice/events/0002_status_changed.json",
    "plan/initiatives/root_pack_schema_catalog_contract_alignment/.wt/tasks/validate_and_close_root_pack_schema_contract_slice/events/0003_status_changed.json",
    "plan/initiatives/root_pack_schema_catalog_contract_alignment/.wt/tasks/validate_and_close_root_pack_schema_contract_slice/task.json",
    "plan/initiatives/root_pack_schema_catalog_contract_alignment/.wt/tasks/widen_root_pack_schema_catalog_contract/events/0001_created.json",
    "plan/initiatives/root_pack_schema_catalog_contract_alignment/.wt/tasks/widen_root_pack_schema_catalog_contract/events/0002_status_changed.json",
    "plan/initiatives/root_pack_schema_catalog_contract_alignment/.wt/tasks/widen_root_pack_schema_catalog_contract/task.json",
    "plan/initiatives/root_pack_schema_catalog_contract_alignment/decision_notes.md",
    "plan/initiatives/root_pack_schema_catalog_contract_alignment/design_record.md",
    "plan/initiatives/root_pack_schema_catalog_contract_alignment/implementation_slice.md",
    "plan/initiatives/root_pack_schema_catalog_contract_alignment/initiative_brief.md",
    "plan/initiatives/root_pack_schema_catalog_contract_alignment/plan.md",
    "plan/initiatives/root_pack_schema_catalog_contract_alignment/progress.md",
    "plan/initiatives/root_pack_schema_catalog_contract_alignment/summary.md"
  ]
}
